[
  {
    "event_id": "evt.__ADAPTER_SLUG__.resource.updated.1",
    "event_type": "__ADAPTER_SLUG__.resource.updated",
    "occurred_at": "2026-03-09T00:00:00Z",
    "recorded_at": "2026-03-09T00:00:00Z",
    "actor": {
      "actor_id": "svc.__ADAPTER_SLUG__.starter",
      "actor_type": "service"
    },
    "subject_entities": ["ent.__ADAPTER_SLUG__.resource.1"],
    "payload": {
      "status": "active"
    }
  }
]
