[
  {
    "event_id": "evt.shipment-delay.0001",
    "event_type": "shipment_delayed",
    "occurred_at": "2026-03-08T11:15:00Z",
    "recorded_at": "2026-03-08T11:16:10Z",
    "payload": {
      "shipment_id": "shipment.88421",
      "delay_hours": 18,
      "cause": "weather"
    },
    "correlation_id": "corr.supply-event.20260308.01"
  }
]
